{
  "$schema": "https://json-schema.org/draft/2020-12/schema",
  "title": "In-Scene Menu Configuration",
  "type": "object",
  "required": ["id", "label", "children"],
  "properties": {
    "id": { "type": "string", "minLength": 1 },
    "label": { "type": "string", "minLength": 1 },
    "children": {
      "type": "array",
      "items": { "$ref": "#/$defs/menuNode" }
    },
    "menuSettings": {
      "type": "object",
      "properties": {
        "position": { "$ref": "#/$defs/vector3" }
      },
      "additionalProperties": false
    },
    "cameraSettings": {
      "type": "object",
      "properties": {
        "home": {
          "type": "object",
          "properties": {
            "position": { "$ref": "#/$defs/vector3" },
            "focusOffset": { "$ref": "#/$defs/vector3" }
          },
          "additionalProperties": false
        },
        "idlePan": {
          "type": "object",
          "properties": {
            "axis": { "enum": ["x", "y", "z"] },
            "amplitude": { "type": "number", "minimum": 0 },
            "period": { "type": "number", "exclusiveMinimum": 0 }
          },
          "additionalProperties": false
        }
      },
      "additionalProperties": false
    }
  },
  "additionalProperties": false,
  "$defs": {
    "vector3": {
      "type": "object",
      "required": ["x", "y", "z"],
      "properties": {
        "x": { "type": "number" },
        "y": { "type": "number" },
        "z": { "type": "number" }
      },
      "additionalProperties": false
    },
    "menuNode": {
      "type": "object",
      "required": ["id", "label", "type"],
      "properties": {
        "id": { "type": "string", "minLength": 1 },
        "label": { "type": "string", "minLength": 1 },
        "type": { "enum": ["group", "action", "back"] },
        "children": {
          "type": "array",
          "items": { "$ref": "#/$defs/menuNode" }
        },
        "presentation": {
          "type": "object",
          "properties": {
            "position": { "$ref": "#/$defs/vector3" },
            "rotation": {
              "$ref": "#/$defs/vector3",
              "description": "Fixed XYZ Euler rotation in degrees."
            },
            "size": { "type": "number", "exclusiveMinimum": 0 },
            "childSize": {
              "type": "number",
              "exclusiveMinimum": 0,
              "description": "Default text size for the child options displayed in this menu level; an individual child's presentation.size overrides this value."
            }
          },
          "additionalProperties": false
        },
        "camera": {
          "type": "object",
          "required": ["position", "focus"],
          "properties": {
            "position": { "$ref": "#/$defs/vector3" },
            "focus": { "$ref": "#/$defs/vector3" },
            "idlePan": {
              "type": "object",
              "description": "Optional idle-pan override for this camera viewpoint; omitted fields inherit the currently configured pan.",
              "properties": {
                "axis": { "enum": ["x", "y", "z"] },
                "amplitude": { "type": "number", "minimum": 0 },
                "period": { "type": "number", "exclusiveMinimum": 0 }
              },
              "additionalProperties": false
            },
            "transition": {
              "type": "object",
              "properties": {
                "duration": { "type": "number", "minimum": 0 },
                "easing": { "enum": ["linear", "easeInOut"] }
              },
              "additionalProperties": false
            }
          },
          "additionalProperties": false
        },
        "target": { "type": ["string", "null"] },
        "description": { "type": ["string", "null"] },
        "isBackOption": { "type": "boolean" }
      },
      "additionalProperties": false
    }
  }
}